{
  "$schema": "./recipes.schema.json",
  "schemaVersion": 1,
  "mise": {
    "requiredVersion": "2026.5.15",
    "config": "crates/hookkit-pkl-config/validation/provisioning/mise.toml",
    "lock": "crates/hookkit-pkl-config/validation/provisioning/mise.lock",
    "provisioningNetwork": "required"
  },
  "controlledEnvironment": {
    "clearInherited": true,
    "home": "neutral-system-temporary",
    "seededVariables": [
      "HOME",
      "LANG",
      "PATH",
      "SHELL",
      "TERM",
      "USER"
    ],
    "set": {
      "LC_ALL": "C",
      "TZ": "UTC"
    }
  },
  "sharedComponents": [
    {
      "id": "jq",
      "version": "1.8.2",
      "miseTool": "jq@1.8.2",
      "installationSource": "jqlang/jq 1.8.2 macOS arm64 release asset locked by SHA-256 with GitHub SLSA provenance",
      "integrity": {
        "kind": "mise-lock",
        "path": "crates/hookkit-pkl-config/validation/provisioning/mise.lock"
      },
      "probe": {
        "argv": ["jq", "--version"],
        "match": "exact",
        "expected": "jq-1.8.2"
      }
    },
    {
      "id": "pkl",
      "version": "0.31.1",
      "miseTool": "pkl@0.31.1",
      "installationSource": "mise aqua:apple/pkl asset locked for macos-arm64",
      "integrity": {
        "kind": "mise-lock",
        "path": "crates/hookkit-pkl-config/validation/provisioning/mise.lock"
      },
      "probe": {
        "argv": ["pkl", "--version"],
        "match": "prefix",
        "expected": "Pkl 0.31.1 "
      }
    },
    {
      "id": "rust",
      "version": "1.90.0",
      "installationSource": "official dated Rust 1.90.0 standalone archive for aarch64-apple-darwin",
      "integrity": {
        "kind": "sha256-archive",
        "url": "https://static.rust-lang.org/dist/2025-09-18/rust-1.90.0-aarch64-apple-darwin.tar.xz",
        "sha256": "9772d20d5cd736079a0ee84d00e6697cf2084f0fc4621b011e24e6f2d08d2d7f",
        "archiveFormat": "tar-xz",
        "archiveRoot": "rust-1.90.0-aarch64-apple-darwin",
        "minOsVersion": "11.0",
        "allowedDylibPrefixes": ["/System/Library/", "/usr/lib/"]
      },
      "probe": {
        "argv": ["rustc", "--version"],
        "match": "prefix",
        "expected": "rustc 1.90.0 "
      }
    },
    {
      "id": "python",
      "version": "3.14.5",
      "miseTool": "python@3.14.5",
      "installationSource": "mise core:python archive locked for macos-arm64; also provides the contract harness socket and path checks",
      "integrity": {
        "kind": "mise-lock",
        "path": "crates/hookkit-pkl-config/validation/provisioning/mise.lock"
      },
      "probe": {
        "argv": ["python", "--version"],
        "match": "exact",
        "expected": "Python 3.14.5"
      }
    },
    {
      "id": "apple-clang",
      "version": "major >=17",
      "installationSource": "Apple developer toolchain selected by the declared macOS host",
      "integrity": {
        "kind": "host-program",
        "path": "/usr/bin/cc"
      },
      "probe": {
        "argv": ["/usr/bin/cc", "--version"],
        "match": "major-at-least",
        "expected": "17"
      }
    },
    {
      "id": "macos-sdk",
      "version": "major >=26",
      "installationSource": "macOS SDK selected by the Apple xcrun host shim",
      "integrity": {
        "kind": "host-program",
        "path": "/usr/bin/xcrun"
      },
      "probe": {
        "argv": ["/usr/bin/xcrun", "--show-sdk-version"],
        "match": "major-at-least",
        "expected": "26"
      }
    },
    {
      "id": "xcode",
      "version": "major >=26",
      "installationSource": "Apple Xcode or Command Line Tools supplied by the declared macOS host",
      "integrity": {
        "kind": "host-program",
        "path": "/usr/bin/xcodebuild"
      },
      "probe": {
        "argv": ["/usr/bin/xcodebuild", "-version"],
        "match": "major-at-least",
        "expected": "26"
      }
    }
  ],
  "sharedBootstrap": [
    {
      "id": "cargo-fetch",
      "argv": ["cargo", "fetch", "--locked", "--manifest-path", "{repository}/Cargo.toml"],
      "environment": {
        "CARGO_HOME": "{state}/cargo-home",
        "CARGO_TARGET_DIR": "{state}/cargo-target"
      },
      "workingDirectory": "/",
      "network": "required",
      "lockfile": "Cargo.lock"
    }
  ],
  "environments": [
    {
      "id": "macos-arm64-data-formats",
      "provisioningGroup": "data-formats",
      "platform": "macos",
      "architecture": "aarch64",
      "osVersionConstraint": ">=26",
      "sandbox": "mise-deny-net",
      "caseNetwork": "denied",
      "components": [],
      "auxiliaryPrograms": [],
      "bootstrap": []
    },
    {
      "id": "macos-arm64-buf",
      "provisioningGroup": "data-formats",
      "platform": "macos",
      "architecture": "aarch64",
      "osVersionConstraint": ">=26",
      "sandbox": "mise-deny-net",
      "caseNetwork": "denied",
      "components": [
        {
          "id": "buf",
          "version": "1.72.0",
          "miseTool": "buf@1.72.0",
          "installationSource": "Buf v1.72.0 Darwin-arm64 release archive locked by SHA-256 in validation/provisioning/mise.lock; upstream checksum list independently verified with minisign",
          "integrity": {
            "kind": "mise-lock",
            "path": "crates/hookkit-pkl-config/validation/provisioning/mise.lock"
          },
          "probe": {
            "argv": ["buf", "--version"],
            "match": "exact",
            "expected": "1.72.0"
          }
        },
        {
          "id": "apple-diff",
          "version": "Apple diff (based on FreeBSD diff)",
          "installationSource": "Apple /usr/bin/diff supplied by the declared macOS host for Buf unified-diff rendering",
          "integrity": {
            "kind": "host-program",
            "path": "/usr/bin/diff"
          },
          "probe": {
            "argv": ["/usr/bin/diff", "--version"],
            "match": "exact",
            "expected": "Apple diff (based on FreeBSD diff)"
          }
        }
      ],
      "auxiliaryPrograms": ["diff"],
      "bootstrap": []
    },
    {
      "id": "macos-arm64-node",
      "provisioningGroup": "node",
      "platform": "macos",
      "architecture": "aarch64",
      "osVersionConstraint": ">=26",
      "sandbox": "mise-deny-net",
      "caseNetwork": "denied",
      "components": [
        {
          "id": "node",
          "version": "24.18.0",
          "miseTool": "node@24.18.0",
          "installationSource": "mise core:node archive locked for macos-arm64",
          "integrity": {
            "kind": "mise-lock",
            "path": "crates/hookkit-pkl-config/validation/provisioning/mise.lock"
          },
          "probe": {
            "argv": ["node", "--version"],
            "match": "exact",
            "expected": "v24.18.0"
          }
        },
      {
        "id": "@astrojs/check",
        "version": "0.9.10",
        "installationSource": "@astrojs/check 0.9.10 in the exact npm dependency graph with package integrity hashes in validation/provisioning/node/package-lock.json",
        "runtimeComponentIds": ["node"],
          "integrity": {
            "kind": "npm-lock",
            "path": "crates/hookkit-pkl-config/validation/provisioning/node/package-lock.json"
          },
          "probe": {
            "argv": ["node", "-p", "JSON.parse(require('node:fs').readFileSync(require('node:path').join(require.resolve('@astrojs/check'), '..', '..', 'package.json'))).version"],
            "match": "exact",
            "expected": "0.9.10"
          }
        },
      {
        "id": "typescript",
        "version": "6.0.3",
        "installationSource": "TypeScript 6.0.3 in the exact npm dependency graph with package integrity hashes in validation/provisioning/node/package-lock.json",
        "runtimeComponentIds": ["node"],
          "integrity": {
            "kind": "npm-lock",
            "path": "crates/hookkit-pkl-config/validation/provisioning/node/package-lock.json"
          },
          "probe": {
            "argv": ["node", "-p", "require('typescript/package.json').version"],
            "match": "exact",
            "expected": "6.0.3"
          }
        }
      ],
      "auxiliaryPrograms": ["npm"],
      "bootstrap": [
        {
          "id": "npm-ci",
          "argv": [
            "npm",
            "ci",
            "--ignore-scripts",
            "--prefix",
            "{state}/node"
          ],
          "network": "required",
          "lockfile": "crates/hookkit-pkl-config/validation/provisioning/node/package-lock.json"
        }
      ]
    },
    {
      "id": "macos-arm64-python",
      "provisioningGroup": "python",
      "platform": "macos",
      "architecture": "aarch64",
      "osVersionConstraint": ">=26",
      "sandbox": "mise-deny-net",
      "caseNetwork": "denied",
      "components": [
        {
          "id": "pip",
          "version": "26.1.1",
          "installationSource": "default pip package distributed with the locked Python 3.14.5 runtime",
          "integrity": {
            "kind": "runtime-bundled",
            "componentId": "python"
          },
          "probe": {
            "argv": ["python", "-m", "pip", "--version"],
            "match": "prefix",
            "expected": "pip 26.1.1 from "
          }
        }
      ],
      "auxiliaryPrograms": ["python", "pip"],
      "bootstrap": [
        {
          "id": "python-venv",
          "argv": ["python", "-m", "venv", "--clear", "{state}/python-venv"],
          "network": "denied",
          "lockfile": null
        },
        {
          "id": "pip-install",
          "argv": [
            "{state}/python-venv/bin/python",
            "-m",
            "pip",
            "install",
            "--require-hashes",
            "--only-binary=:all:",
            "--requirement",
            "{repository}/crates/hookkit-pkl-config/validation/provisioning/python/requirements-macos-arm64.txt"
          ],